espn_id;home_team;away_team;home_abbrev;away_abbrev;score_home;score_away;date;cup;article_title;article;id;homeContestantId;awayContestantId;homeContestantOfficialName;awayContestantOfficialName;homeContestantCode;awayContestantCode;card_events;venue;goal_events
637319;;;FEY;EXC;5;1;2022-11-13Z;2022-23 Eredivisie, Regulier seizoen;Feyenoord herfstkampioen na overtuigende overwinning op Excelsior;"Feyenoord is de herfstkampioen van de Eredivisie na een overtuigende 5-1 overwinning op stadsgenoot Excelsior. De bezoekers kwamen nog wel op voorsprong in de Kuip, maar verloren uiteindelijk met ruime cijfers.

 Voorafgaand aan het Rotterdamse onderonsje ging het voornamelijk over het eventuele herfstkampioenschap van Feyenoord. Eerst werd Feyenoord-icoon Cor van der Gijp, die afgelopen week op 91-jarige leeftijd overleed, herdacht. Dat deed het met de neef van Cor, René van der Gijp, op de tribune.

 Feyenoord herstelt achterstand
Na de minuut stilte begon Feyenoord, met Santiago Gimenez in de spits in plaats van Danilo, de beslissende wedstrijd om het herfstkampioenschap. Het leek alleen na vijf minuten een zware middag te worden voor Feyenoord. Kenzo Goudmijn schoot op aangeven van Marouan Azarkan de vroege voorsprong voor Excelsior op het bord.

 Hoewel Excelsior-fans waarschijnlijk niet de enige waren die met blije gezichten naar de tussenstand keken, was de voorsprong van korte duur. Sebastian Szymanski schoot fraai raak vanaf de rand van het zestienmetergebied voor de gelijke stand na iets meer dan tien minuten.

 Tien minuten later draaide Feyenoord de achterstand helemaal om, toen aanvoerder Orkun Kökçü een vrije trap via de muur langs Excelsior-keeper Stijn van Gassel schoot. Het was ook de ruststand in de Kuip, ondanks dat genoeg slordigheden van beide kanten voldoende kansen opleverde in de eerste helft.

 Szymanski en Kökçü maken hun tweede
In de rust namen Luis Sinisterra en Marcos Senesi afscheid van de fans in de Kuip. De twee vertrokken afgelopen zomer naar de Premier League, maar zijn zeker nog niet vergeten door de Feyenoord-fans. Beide Zuid-Amerikanen zagen vijf minuten na rust Szymanski, die met Polen naar het WK gaat, zijn tweede en Feyenoords derde maken. Opnieuw was het Dilrosun met de assist.

 Net na het uur kreeg Excelsior de vierde om de oren. Kökçü tekende ook aan voor zijn tweede, nadat hij de bal mooi uit de lucht plukte met een volley. Invaller Patrik Wålemark mocht ook nog een duit in het zakje doen en tekende in de 78ste minuut aan voor de vijfde van Feyenoord.

 Het werd een afstraffing voor de ploeg van Marinus Dijkhuizen, die snakte naar het laatste fluitsignaal en uiteindelijk met ruime cijfers de Kuip verlieten. Daardoor blijft Excelsior op een 13de plek steken.

 Feyenoord herfstkampioen
Feyenoord zet door de overwinning Ajax en PSV op drie punten achterstand, terwijl AZ volgt met vier punten minder dan de Rotterdammers.

 De laatste elf keer dat Feyenoord met de meeste punten de winterstop inging, eindigde het aan het eind van het seizoen maar liefst zeven keer als kampioen. Het belooft wat voor de tweede seizoenshelft in de Eredivisie.

###

";3evzc6yl7a4wh3pi8r2kq58us;20vymiy7bo8wkyxai3ew494fz;dqk062lu0vm8epvytbm6r4mmf;Feyenoord Rotterdam;SBV Excelsior;FEY;EXC;[['Excelsior', 'dqk062lu0vm8epvytbm6r4mmf', 1, 19, '7y0acvcg9km8dz51t5ndy23md', 'M. van Duinen', 'YC'], ['Feyenoord', '20vymiy7bo8wkyxai3ew494fz', 1, 26, 'e0cy0gwf04lohf0xjef0af8fe', 'Igor Paixão', 'YC'], ['Feyenoord', '20vymiy7bo8wkyxai3ew494fz', 2, 47, '4fcjml5xkrwp4jykruzrzub1m', 'Q. Hartman', 'YC'], ['Excelsior', 'dqk062lu0vm8epvytbm6r4mmf', 2, 74, 'f07qmqesi1rpw7eapoz9rb0gk', 'J. Baas', 'YC'], ['Excelsior', 'dqk062lu0vm8epvytbm6r4mmf', 2, 83, '4w7a5n358oifbqkyftop0rtka', 'J. Donkor', 'YC']];Stadion Feijenoord;[['Excelsior', 'dqk062lu0vm8epvytbm6r4mmf', 1, 4, 'a46irqckxabod18j2c0qfixre', 'K. Goudmijn'], ['Feyenoord', '20vymiy7bo8wkyxai3ew494fz', 1, 11, '504o2odlvra056ouwcgreopgp', 'S. Szymański'], ['Feyenoord', '20vymiy7bo8wkyxai3ew494fz', 1, 20, 'djbw3afgcgkbq22soig0xsjfu', 'O. Kökçü'], ['Feyenoord', '20vymiy7bo8wkyxai3ew494fz', 2, 50, '504o2odlvra056ouwcgreopgp', 'S. Szymański'], ['Feyenoord', '20vymiy7bo8wkyxai3ew494fz', 2, 66, 'djbw3afgcgkbq22soig0xsjfu', 'O. Kökçü'], ['Feyenoord', '20vymiy7bo8wkyxai3ew494fz', 2, 78, '1957std7hji9ca7bd29y8at7u', 'P. Wålemark']]
637320;;;PSV;AZ;0;1;2022-11-12Z;2022-23 Eredivisie, Regulier seizoen;PSV profiteert niet van misstap Ajax en verliest koppositie;"PSV is er niet in geslaagd de koppositie in de Eredivisie te pakken. In eigen huis verloor de ploeg van Ruud van Nistelrooij met 0-1 van AZ. De Eindhovenaren vergeten hierdoor te profiteren van de misstap die Ajax eerder op de avond beging. De Amsterdammers kwamen in en tegen Emmen niet verder dan een 3-3 gelijkspel.

 Het enige doelpunt van de wedstrijd viel na zeventien minuten. Vangelis Pavlidis, die terugkeerde in de basis na een blessure, strafte een fout van Joey Veerman koelbloedig af, door de bal behendig over de uitkomende Walter Benítez heen te wippen. Daarna golfde het spel op en neer. Cody Gakpo was dichtbij de gelijkmaker, maar kopte rakelings voorlangs, in de tegenaanval was Jens Odgaard dichtbij, maar de Deen schoot in het zijnet.

 Na een half uur dacht PSV naast de Alkmaarders te komen. Linksback Philipp Max dacht net als Pavlidis met een lobje te scoren, maar Sam Beukema kopte de bal uit het doel. Drie minuten later kopte Érick Gutiérrez op de paal. Vlak voor rust raakte Odgaard namens AZ de lat, waardoor de Alkmaarders met een voorsprong de kleedkamer opzocht.

 Van Nistelrooij grijpt in 
In de rust greep Ruud van Nistelrooij in. Ramalho en Gutiérrez bleven achter in de kleedkamer, Jarrad Brantwaithe en Anwar El Ghazi kwamen voor hen in de ploeg. Tien minuten in de tweede helft dacht PSV op gelijke hoogte te komen, Gakpo kopte van dichtbij geheel vrijstaand binnen, maar de aanvaller stond buitenspel. In het vervolg van de wedstrijd speelde PSV voornamelijk tegen zichzelf, en leek de ploeg machteloos.

 Toch was de thuisclub vlak voor tijd nog dichtbij. Invaller Noni Madueke speelde zichzelf schitterend vrij in het strafschopgebied, maar schoot uit een moeilijke hoek op de paal. Door de nederlaag gaat PSV niet als koploper de winterstop in. De Eindhovenaren in punten gelijk met Ajax en Feyenoord, maar hebben een minder doelsaldo dan de Amsterdammers. Feyenoord komt morgen nog in actie in de stadsderby tegen Excelsior.

###

";3f7i5p9sa8hnuk1tu5q1nytqs;24fvcruwqrqvqa3aonf8c3zuy;3kfktv64h7kg7zryax1wktr5r;PSV Eindhoven;Alkmaar Zaanstreek;PSV;AZ;[['AZ', '3kfktv64h7kg7zryax1wktr5r', 1, 38, 'ad2qplv0aa66l11ipq6yh0hd5', 'Y. Sugawara', 'YC'], ['AZ', '3kfktv64h7kg7zryax1wktr5r', 2, 86, 'a2zavv31d2aadyddk0kjttdgq', 'M. Kerkez', 'YC']];Philips Stadion;[['AZ', '3kfktv64h7kg7zryax1wktr5r', 1, 18, '7sd87ylfbtgwgpb70hf68cel1', 'V. Pavlidis']]
637321;;;TWE;EMM;2;0;2023-01-06Z;2022-23 Eredivisie, Regulier seizoen;Twente zet Emmen eenvoudig opzij dankzij schitterende treffer van emotionele Sadilek;"FC Twente heeft de Eredivisie hervat met een eenvoudige zege op FC Emmen. In eigen huis won de ploeg van Ron Jans met 2-0. Bij de thuisploeg stond Ramiz Zerrouki gewoon in de basis.

 Zerrouki zou in de nadrukkelijke belangstelling staan van Feyenoord, maar Twente wil de 24-jarige middenvelder vooralsnog niet laten gaan. Ook Alfson Sampsted, die in de winterstop transfervrij overkwam van het Noorse FK Bodø/Glimt, begon aan de aftrap - na een minuut stilte vanwege het overlijden van de Braziliaanse voetballegende Pelé vorige week.

 Snelle treffer
Twente had slechts zes minuten nodig om de score te openen. Een van richting veranderde voorzet werd door Ricky van Wolfswinkel bij de eerste paal van dichtbij ingetikt. Zo mag de spits van Twente zichzelf de eerste Eredivisie-doelpuntenmaker van 2023 noemen.

 Dick Lukkien gaf voorafgaand aan de wedstrijd aan dat zijn ploeg is gegroeid in het verdedigen, maar Emmen bracht in de Grolsch Veste juist aanvalled te weinig om het Twente lastig te maken. En Twente verdubbelde halverwege de tweede helft ook nog eens de voorsprong.

 Emotioneel
Uitgerekend Michal Sadilek schoot van net buiten het zestienmetergebied schitterend raak. De Tsjechische international was een lange tijd uit de roulatie. Hij kampte met een liesblessure en oorsuizen en dacht zelfs even aan stoppen. Na een revalidatie van ruim vier maanden was Sadilek emotioneel na zijn doelpunt.

 ""Alle emoties die ik de afgelopen vier maanden had kwamen er uit. Dankzij de supporters en mijn teamgenoten kon ik weer terugkomen. Ik ben heel blij met deze overwinning. Het is heel lastig geweest. Ik had overal hoofdpijn. Elk geluid was pijnlijk voor mij. Nu ben ik langzaam aan het wennen aan alle geluiden. Dat is wel positief. Het komt goed"", aldus Sadilek na afloop.

 ""Ik ben twee keer teruggeweest naar Tsjechië voor een second opinion. Ik ben dankbaar voor alle mensen die me geholpen hebben. Het was een heel moeilijke periode voor mij. Ik sliep slecht en voelde me niet fijn. Dat is achter mij. Nu wil ik alleen maar naar voren kijken en naar een mooie toekomst.""

 FC Twente-speler Michal Sadílek na afloop van het Eredivisie-duel tussen FC Twente en FC Emmen.

 Door de zege staat Twente nu op een gedeelde tweede plaats, samen met Ajax en PSV. De concurrentie uit de top vijf van de Eredivisie komt dit weekend nog wel in actie. Emmen bezet plek zestien en staat drie punten boven de degradatiestreep.

###

";3fjzm0lpj2i6e2oyl2cjm7qxg;4tic29sox7m39fy1ztgv0jsiq;3t0vjqtxc8wpjzv82i3oi2ova;FC Twente;FC Emmen;TWE;EMM;[['Twente', '4tic29sox7m39fy1ztgv0jsiq', 1, 31, '69cvlhfo7ulmz4o5ztlj1wlm2', 'M. Hilgers', 'YC'], ['Emmen', '3t0vjqtxc8wpjzv82i3oi2ova', 2, 87, 'e605oixdrqumxkqm0y1bijbvt', 'J. Assehnoun', 'YC'], ['Emmen', '3t0vjqtxc8wpjzv82i3oi2ova', 2, 91, '4l8n194otkmyc3op4u111l5n9', 'M. Heylen', 'YC']];De Grolsch Veste;[['Twente', '4tic29sox7m39fy1ztgv0jsiq', 1, 5, '36veg0wk1z3om89daf0clbl5h', 'R. van Wolfswinkel'], ['Twente', '4tic29sox7m39fy1ztgv0jsiq', 2, 67, '9qoc020keotb4s72a09zm5pzp', 'M. Sadílek']]
637322;;;RKC;HEE;0;0;2023-01-07Z;2022-23 Eredivisie, Regulier seizoen;RKC en Heerenveen komen niet tot scoren in Waalwijk;"RKC Waalwijk en sc Heerenveen zijn er niet in geslaagd om te scoren. Zaterdagavond stond na negentig minuten spelen de brilstand op het bord, ondanks dat de teams de nodige kansen kregen.

 Bij RKC ontbrak Michiel Kramer in de punt van de aanval. De spits kampt met een rugblessure en was nog niet fit genoeg om deel uit te maken van de wedstrijdselectie. Joseph Oosting kon ook niet beschikken over de geschorste Iliass Bel Hassani en de geblesseerde Julen Lobete. Door het wegvallen van Kramer kon Mats Seuntjens meteen zijn debuut maken voor RKC. Het eerste gevaar van de wedstrijd kwam ook van de schoen van Seuntjens. Na een mooie aanval probeerde hij Andries Noppert te testen, maar de bal ging over.

 Het eerste schot op doel van de wedstrijd kwam van de voet van Rami Al Hajj. De middenvelder van Heerenveen maakte het Etienne Vaessen lastig met een afstandschot, maar de doelman had zijn antwoord klaar. Noppert moest ook in de eerste helft nog aan de bak. Hij zag Mika Biereth van dichtbij uithalen, maar kon de openingstreffer nog net voorkomen met zijn voet. Er werd niet gescoord in de eerste helft.

 Na rust moesten de keepers hun teams ook weer meerdere malen behoeden voor een tegentreffer. Met name Vaessen hield zijn team op de been. De doelman van RKC kwam in de wedstrijd tot maar liefst negen reddingen. Zijn doel bleef schoon, net als die van Noppert en daarom eindigde het duel in een 0-0 gelijkspel.

 Het is voor Heerenveen alweer het vijfde doelpuntloze gelijkspel dit Eredivisieseizoen. Het is de eerste keer dat een team dit zo vaak deed in één jaargang sinds 2016/17 (toen Roda JC en Willem II 5 keer). De vijf doelpuntloze remises van Heerenveen dit seizoen is het hoogste aantal voor de Friezen in een jaargang sinds 2001/02 (toen 6 keer).

###

";3fqce463ch1h61to42xnrx05w;ed5nwjz5za3oyi20nxzgqivmx;4vd2t5schmvvufrfib7f2vjdf;RKC Waalwijk;SC Heerenveen;RKC;HEE;[['Heerenveen', '4vd2t5schmvvufrfib7f2vjdf', 1, 26, '7jtag81mvpom3bfgezx8txbdh', 'T. Haye', 'YC'], ['RKC Waalwijk', 'ed5nwjz5za3oyi20nxzgqivmx', 1, 40, '8przxwwothu3crflys7ahl4dm', 'S. Adewoye', 'YC']];Mandemakers Stadion;[]
637323;;;AZ;VIT;1;1;2023-01-07Z;2022-23 Eredivisie, Regulier seizoen;Schitterende pegel Pavlidis niet voldoende voor zege AZ;"AZ is het nieuwe jaar begonnen met een 1-1 gelijkspel tegen Vitesse. Vangelis Pavlidis opende de score met een schitterende pegel, Mohamed Sankoh maakte vlak voor tijd gelijk.

 Vooraf ging het voornamelijk over de contractverlenging van Tijjani Reijnders. De sterkhouder van AZ heeft zijn contract tot de zomer van 2027 verlengd. Hij vormde tegen Vitesse het middenveld samen met Jordy Clasie en debutant Djordje Mihailovic. De aanvallende middenvelder verving Dani de Wit, die ontbrak vanwege een schorsing. Ook bij Vitesse een debutant. Mitchell Dijks maakte zijn eerste minuten van dit seizoen na een slepende knieblessure.

 Na een afwachtende openingsfase was het debutant Mihailovic die bij zijn eerste wedstrijd voor AZ de score kon openen. Hij faalde oog in oog met Kjell Scherpen, die knap redde. AZ had in de eerste helft de overhand maar kon verder geen levensgrote kansen creëren.

 Na rust was het Vitesse dat sterk uit de kleedkamer kwam. De ploeg van Phillip Cocu, dat na een belabberde start van het seizoen weg wil uit het rechterrijtje kreeg een aantal goede mogelijkheden. Het vizier van onder anderen Million Manhoef stond echter net niet op scherp.

 Een kwartier voor tijd werd AZ eindelijk weer eens gevaarlijk. Dat leverde gelijk de openingstreffer op. Na een fijne assist van Jens Odgaard rondde Pavlidis schitterend af. Het was alleen niet genoeg voor de overwinning. Drie minuten voor tijd kon Sankoh profiteren van miscommunicatie achterin bij de Alkmaarders. De invaller werkte een voorzet van Arcus van dichtbij binnen.

###

";3fuf3g2bwevdvj8jtdrex8l5g;3kfktv64h7kg7zryax1wktr5r;6hsriqr3ybvyg94w2k19oal50;Alkmaar Zaanstreek;SBV Vitesse;AZ;VIT;[['Vitesse', '6hsriqr3ybvyg94w2k19oal50', 1, 34, '4212luiyivgvje1vm1ojieicq', 'G. Vidović', 'YC'], ['AZ', '3kfktv64h7kg7zryax1wktr5r', 1, 42, 'ad2qplv0aa66l11ipq6yh0hd5', 'Y. Sugawara', 'YC'], ['AZ', '3kfktv64h7kg7zryax1wktr5r', 2, 93, '3uq3lrjyj4mnvq6162b0jyhnt', 'M. de Wit', 'YC']];AFAS Stadion;[['AZ', '3kfktv64h7kg7zryax1wktr5r', 2, 77, '7sd87ylfbtgwgpb70hf68cel1', 'V. Pavlidis'], ['Vitesse', '6hsriqr3ybvyg94w2k19oal50', 2, 87, 'b2uznyb9b8fxsy57450mbmwru', 'M. Sankoh']]
637324;;;FOR;GAE;0;2;2023-01-07Z;2022-23 Eredivisie, Regulier seizoen;Go Ahead Eagles trekt ongeslagen reeks door in 2023 met zege op Fortuna Sittard;"Go Ahead Eagles heeft zaterdagavond met 0-2 gewonnen op bezoek bij Fortuna Sittard. René Hake en zijn team zijn bezig aan een indrukwekkende reeks, want dit is alweer de tiende wedstrijd op rij waarin ze ongeslagen blijven. De drie punten zorgen ervoor dat Go Ahead nu op achttien punten komt. Daarmee gaat het op doelsaldo over RKC heen dat eerder op de avond even in het linkerrijtje stond.

 Er gebeurde genoeg in de eerste helft tussen Go Ahead en Fortuna. Een greep uit de gebeurtenissen in de eerste 45 minuten: Twee goals, Fortuna-trainer Julio Velázquez die een klap uitdeelt aan de dug-out en een opstootje tussen de twee teams.

 Bas Kuipers opende de score in de 21ste minuut. De aanvoerder van Go Ahead Eagles was meegeslopen en had veel ruimte om uiteindelijk makkelijk binnen te schieten uit een lage voorzet van Bobby Adekanye. Adekanye wist het net zelf ook nog te vinden. Vlak voor rust werd de aanvaller weggestuurd door Enric Llansana en met een beheerst stiftje was hij doelman Ivor Pandur te slim af. Zo gingen de Eagles met een comfortabele voorsprong de rust in.

 In de tweede helft was het wat rustiger. Go Ahead kreeg nog wel een flinke tegenvaller te verwerken. Aanvoerder Kuipers moest er na zeventig minuten spelen namelijk per brancard af nadat hij pijnlijk ten val kwam. Zonder hem trokken de Eagles de 0-2 overwinning uit het vuur.

###

";3fy6jt2kmryzq938l39esb2ms;3ebril33e08ddzob4bhq8awsr;b79uipsy57y1jqpy07h4i5ovk;Fortuna Sittard;Go Ahead Eagles;FOR;GAE;[['Fortuna Sittard', '3ebril33e08ddzob4bhq8awsr', 1, 4, 'b2h6iojtnu8rzb81vw4rbfrop', 'G. Cox', 'YC'], ['Go Ahead Eagles', 'b79uipsy57y1jqpy07h4i5ovk', 1, 17, '7lpwkpwfw656re3pymntslv55', 'B. Adekanye', 'YC'], ['Fortuna Sittard', '3ebril33e08ddzob4bhq8awsr', 2, 56, 'hjb0mn4fgmfiimwn5odvl8fd', 'T. Buitink', 'YC'], ['Go Ahead Eagles', 'b79uipsy57y1jqpy07h4i5ovk', 2, 80, '5n65xhwbd6dm3uynl4h7k920a', 'E. Llansana', 'YC'], ['Fortuna Sittard', '3ebril33e08ddzob4bhq8awsr', 2, 91, 'emrt1s5yfgtex867u98gbt0fe', 'T. Taşçı', 'YC'], ['Fortuna Sittard', '3ebril33e08ddzob4bhq8awsr', 2, 94, '8rqula41yqtbwycgemsw9ixud', 'B. Yılmaz', 'YC']];Fortuna Sittard Stadion;[['Go Ahead Eagles', 'b79uipsy57y1jqpy07h4i5ovk', 1, 21, '6ydojoa3581jgszpjqj7i8zpx', 'B. Kuipers'], ['Go Ahead Eagles', 'b79uipsy57y1jqpy07h4i5ovk', 1, 44, '7lpwkpwfw656re3pymntslv55', 'B. Adekanye']]
637325;;;PSV;SPA;0;0;2023-01-07Z;2022-23 Eredivisie, Regulier seizoen;PSV begint 2023 met puntenverlies tegen Sparta;"PSV is er in eigen huis niet in geslaagd Sparta Rotterdam te verslaan. In Eindhoven eindigde de wedstrijd in 0-0. Tijdens de eerste officiële wedstrijd zonder Cody Gakpo wist PSV niet te overtuigen. Ondanks een redelijke start van Anwar El Ghazi op linksbuiten, bleef de creativiteit bij de Eindhovenaren uit. Door het gelijke spel hebben Feyenoord en Ajax op zondag de kans om uit te lopen. Sparta zal tevreden zijn met het gelijke spel, zeker gezien de zesde plaats die nog altijd in stand is.

 PSV begon de wedstrijd dominant, maar wist de kansen niet af te maken in de openingsfase. Na zo'n twintig minuten nam de ploeg uit Eindhoven gas terug en werd het restant van de eerste helft een zeer trage pot zonder al teveel kansen. De mogelijkheden die er kwamen waren nog wel voor PSV, waaronder de grootste voor Xavi Simons, maar ze bleven slordig in de afronding. Zo bleef het bij rust op een 0-0 gelijke stand en begon de druk voor de Eindhovenaren al snel toe te nemen.

 En dat zorgde voor zichtbare frustratie in de tweede helft, waar scheidrechter Sander van der Eijk in het eerste kwartier druk in de weer was met de vele overtredingen en opstootjes. Het kwam het spel niet ten goede, want ook in het tweede gedeelte bleven de kansen uit. Terwijl de wedstrijd alsmaar slordiger werd, kreeg de thuisploeg steeds meer kansen. Voor de goal bleef het alleen te wild om echt gevaarlijk te worden. Dat gevaar leek er toch te gaan komen op het moment dat scheidsrechter Van der Eijk door de VAR naar de kant gestuurd wordt om een lompe tackle van Michael Pinto te beoordelen, maar besloot geen penalty te geven.

 Scheidsrechter Sander van der Eijk geeft PSV geen strafschop na ingrijpen van de VAR.

 Het bleek ook meteen de laatste kans op enige spanning, want ook in de slotfase bleef de echte druk van PSV uit en wist Sparta gemakkelijk op de been te blijven. Daarmee is een gelijkspel terecht, zelfs al had PSV duidelijk de overhand.

###

";3g225p69h4qbvavenjesxzrbo;24fvcruwqrqvqa3aonf8c3zuy;89w5c6pw7vn0dxypi61tt0g4k;PSV Eindhoven;Sparta Rotterdam;PSV;SPA;[['Sparta Rotterdam', '89w5c6pw7vn0dxypi61tt0g4k', 1, 45, '5gs7jd1eigk4jisxbr9a1yvp', 'B. Vriends', 'YC'], ['PSV', '24fvcruwqrqvqa3aonf8c3zuy', 2, 51, 'e3il1t1s5lrn4g8t85fcm40oa', 'N. Madueke', 'YC'], ['Sparta Rotterdam', '89w5c6pw7vn0dxypi61tt0g4k', 2, 52, '2nwthqvbk70e2qo35dgp35979', 'V. van Crooij', 'YC'], ['Sparta Rotterdam', '89w5c6pw7vn0dxypi61tt0g4k', 2, 70, '723av2redj2ej6livx0g81wwl', 'A. Verschueren', 'YC']];Philips Stadion;[]
637326;;;UTR;FEY;1;1;2023-01-08Z;2022-23 Eredivisie, Regulier seizoen;Feyenoord neemt punt mee uit Galgenwaard dankzij late treffer Jahanbakhsh;"Herfstkampioen Feyenoord heeft de koppositie weten te behouden dankzij een laat gelijkspel tegen FC Utrecht. In de Galgenwaard werd het 1-1. Bij de ploeg van Arne Slot ontbraken de langdurig geblesseerden Gernot Trauner en Quinten Timber.

 Vooraf waren veel ogen gericht op Jens Toornstra. De middenvelder keerde afgelopen zomer na acht jaar Feyenoord terug in de Galgenwaard, en speelde voor het eerst tegen zijn oude club. Het verhaal werd nog mooier toen Toornstra na twee minuten de score opende, door de bal van dichtbij achter Justin Bijlow te schieten.

 Blessure Paixão
Feyenoord ging daarna nadrukkelijk op zoek naar de gelijkmaker. De Rotterdammers waren in de tiende minuut dichtbij, maar het schot van Danilo belandde op de lat. Het vervolg tot aan de rust was vooral spannend, zonder echt grote kansen. Voor Arne Slot was het uitvallen van Igor Paixão een smet op de eerste helft. Tien minuten na rust gooide Slot met drie wissels zijn elftal om. Mats Wieffer, Alireza Jahanbakhsh en Santiago Giménez kwamen in het veld voor Danilo, Jacob Rasmussen en Javairô Dilrosun.

 Daarna was het lang wachten op de eerste grote kans. Na 70 minuten waren de bezoekers het dichtstbij, maar het schot van Sebastian Szymański ging over het Utrechtse doel. Even later was het invaller Giménez die alleen op Utrecht-keeper Vasilios Barkas af kon, maar de Griek lag in de weg.

 Late gelijkmaker
Ook invaller Anastasios Douvikas, de andere Griek in Utrechtse dienst, had de kans tot uitblinker uit te groeien. Maar acht minuten voor tijd schoot de spits op de paal. In de blessuretijd kwam Feyenoord toch langszij. Een door een Utrechts hoofd verlengde voorzet van Oussama Idrissi kwam voor de voeten van Jahanbakhsh, die hard en hoog uithaalde.

###

";3g61qc2bcwosvs00fhr1lthck;ccpscwdcm65czscrun048ecn5;20vymiy7bo8wkyxai3ew494fz;FC Utrecht;Feyenoord Rotterdam;UTR;FEY;[['Feyenoord', '20vymiy7bo8wkyxai3ew494fz', 1, 46, 'a89554tzfy4nfxrycpr2z0xjp', 'O. Idrissi', 'YC'], ['Utrecht', 'ccpscwdcm65czscrun048ecn5', 1, 46, 'aafz6q5ggn9e6m5hprc71lgph', 'M. van der Hoorn', 'YC'], ['Utrecht', 'ccpscwdcm65czscrun048ecn5', 2, 60, '1s7vp9ovsa1jo7tu7nisykn9x', 'M. van der Maarel', 'YC']];Stadion Galgenwaard;[['Utrecht', 'ccpscwdcm65czscrun048ecn5', 1, 3, 'ely6vpyueden4b6ozfmspwgk5', 'J. Toornstra'], ['Feyenoord', '20vymiy7bo8wkyxai3ew494fz', 2, 90, 'a8cgbwioykhqztfjgztfn7dud', 'A. Jahanbakhsh']]
637327;;;CAM;VOL;0;3;2023-01-08Z;2022-23 Eredivisie, Regulier seizoen;Bliksemstart helpt Volendam aan overwinning in kelderkraker tegen Cambuur;"FC Volendam heeft drie enorm belangrijke punten gepakt in de strijd tegen degradatie. Op bezoek bij directe concurrent SC Cambuur won de ploeg van Wim Jonk met 0-3, en staat hiermee de laatste plaats af aan de Leeuwarders. 

 Volendam kende een vliegende start. Na acht minuten was het Bilal Ould-Chikh die op aangeven van de opgekomen back Derry John Murkin een mooie aanval afrondde. Een minuut later Wipte spits Robert Mühren, oud-speler van Cambuur, de bal over de uitgekomen doelman João Virgínia heen. En dus stond de hekkensluiter van de Eredivisie na tien minuten op 0-2.

 Binnen een half uur vond de debuterende Cambuur-trainer Sjors Ultee het al tijd om in te grijpen. Sai van Wermerskerken en Marco Tol moesten naar de kleedkamer, Doke Schmidt en Floris Smand waren hun vervangers. Na rust drong Cambuur meer aan, met kansen voor een andere invaller, Milan Smit.

 Supersub Veerman 
Een kwartier voor tijd was het definitief beslist. Bij een vrije trap voor Volendam werd Mühren vervangen door Henk Veerman, die gelijk doorliep naar het strafschopgebied. De lange spits kopte de afgemeten voorzet van Carel Eiting achter de uitkomende doelman Virgínia. Het is voor Volendam pas de tweede overwinning van het seizoen, de laatste keer dat het andere oranje won was op 28 augustus tegen FC Twente.

###

";3geerrvesr3247aed09w85638;ears40cp6opsgvhsy0dgyszpd;6g9qrm72224jrk6tkxxxi8a9n;SC Cambuur Leeuwarden;FC Volendam;CAM;VOL;[['Cambuur', 'ears40cp6opsgvhsy0dgyszpd', 1, 26, '7pz3qz589b7v3pkb9h0hv73l5', 'D. van Kaam', 'YC'], ['Cambuur', 'ears40cp6opsgvhsy0dgyszpd', 2, 54, '4utb2o5c0e57kf0iwdavpzg15', 'S. van der Water', 'YC'], ['Cambuur', 'ears40cp6opsgvhsy0dgyszpd', 2, 73, '3u2783a9ukglf8yg3dere8wve', 'A. Bangura', 'YC'], ['Volendam', '6g9qrm72224jrk6tkxxxi8a9n', 2, 77, '3kbhgmnf6bhfgut0jxf4m2sfe', 'G. Oristanio', 'YC']];Cambuur Stadion;[['Volendam', '6g9qrm72224jrk6tkxxxi8a9n', 1, 8, '3dc82sro077by40u3qdmhw0r9', 'B. Ould-Chikh'], ['Volendam', '6g9qrm72224jrk6tkxxxi8a9n', 1, 9, '6jqn5grsuhuo5at81pzahr6xh', 'R. Mühren'], ['Volendam', '6g9qrm72224jrk6tkxxxi8a9n', 2, 74, 'c5jk0pvcvqddy0xiqv6qkesph', 'H. Veerman']]
