espn_id;home_team;away_team;home_abbrev;away_abbrev;score_home;score_away;date;cup;article_title;article;id;homeContestantId;awayContestantId;homeContestantOfficialName;awayContestantOfficialName;homeContestantCode;awayContestantCode;card_events;venue;goal_events
637228;;;VOL;TWE;1;0;2022-08-28Z;2022-23 Eredivisie, Regulier seizoen;17-jarige invaller Zeefuik brengt Volendam eerste zege;"FC Volendam heeft verrassend een overwinning geboekt op FC Twente. De 17-jarige invaller Lequincio Zeefuik maakte de enige treffer in Volendam. Hij treedt in de voetsporen van zijn broers Genero en Deyovaisio Zeefuik die ook minimaal een doelpunt maakten in de Eredivisie.

 FC Twente moet de eerste nederlaag in de Eredivisie moeten incasseren. De Tukkers kregen te maken met een uitblinkende Volendam-doelman Filip Stankovic en hielden dus zelfs geen punt over aan het duel in Volendam. Lequincio Zeefuik tikte in de 83e minuut op aangeven van Daryl van Mieghem de enige treffer binnen: 1-0. ""Het doet pijn, we moeten dit makkelijk kunnen winnen"", zei een gefrustreerde Ricky van Wolfswinkel na afloop. ""Het kan niet zo zijn dat ik 20 meter achter een frisse wissel loop en dat ik hem eruit loop met m’n 33 jaar.""

 FC Twente-speler Ricky van Wolfswinkel na afloop van het duel in de Eredivisie tussen FC Volendam en FC Twente.

 Volendam wint voor het eerst sinds 19 april 2009 een duel in de Eredivisie. Twente was voor rust de bovenliggende partij, maar Volendam kwam Robert Mühren bijna op 1-0. De spits raakte echter de lat. Na rust hield Lars Unnerstall z'n ploeg heel lang op de been, maar dat was dus niet genoeg.

 Jans wilde frisheid
FC Twente speelde donderdag nog thuis tegen Fiorentina 0-0, waardoor het geen Europees voetbal speelt. Trainer Ron Jans gaf daardoor drie basisspelers rust. ""Het is gewoon goed dat je concurrentie hebt, maar ook frisheid."" Sem Steijn, Christos Tzolis en Daan Rots mochten beginnen in plaats van Michel Vlap (lichte liesklachten) Vaclav Cerny en Virgil Misidjan. Volendam-trainer Wim Jonk startte met Bilal Ould-Chikh en Achraf Douiri in het elftal.

###

";35ln32b4hl8hswyfnhj40rrx0;6g9qrm72224jrk6tkxxxi8a9n;4tic29sox7m39fy1ztgv0jsiq;FC Volendam;FC Twente;VOL;TWE;[['Volendam', '6g9qrm72224jrk6tkxxxi8a9n', 1, 45, 'eayvrkzzkk0xu4c5rrxgzlroq', 'A. Douiri', 'YC'], ['Volendam', '6g9qrm72224jrk6tkxxxi8a9n', 2, 61, '1sb4655mgzrdohlltyk9fqlzp', 'D. van Mieghem', 'YC']];Kras Stadion;[['Volendam', '6g9qrm72224jrk6tkxxxi8a9n', 2, 83, '792zq4joba1qgt0lusvrjantg', 'L. Zeefuik']]
637229;;;CAM;AZ;0;1;2022-08-28Z;2022-23 Eredivisie, Regulier seizoen;Stroef AZ behoudt perfecte score na moeizame zege op tien van SC Cambuur;"AZ heeft ook de derde wedstrijd van het seizoen gewonnen. In Leeuwarden werd tegen het stugge SC Cambuur moeizaam gewonnen met 1-0. Cambuur speelde ruim een half uur met tien man, na een rode kaart voor Jamie Jacobs.

 In de eerste helft was duidelijk dat AZ de Europese wedstrijd van afgelopen donderdag tegen Gil Vicente nog in de benen had. De wedstrijd kwam moeizaam op gang zonder al te veel grote kansen. De eerste echte kans was voor SC Cambuur. Na een half uur spelen kopte aanvoerder Roberts Uldrikis op de paal. In de tegenaanval was het eindelijk AZ dat gevaarlijk werd, maar het sschot van Vangelis Pavlidis ging over.

 Rode kaart Cambuur
Na kwam bij de ploeg van Pascal Jansen onder anderen Jens Odgaard in het veld. Na 54 minuten moest de thuisploeg met zijn teien verder. Jamie Jacobs maakte een harde overtreding op Odgaard en moest met rood vertrekken. Na de rode kaart zette AZ extra aan en dwong het Cambuur terug in het eigen strafschopgebied. Het resulteerde vlak voor tijd in een grote kans van de wedstrijd voor invaller Mayckel Lahdo. Maar de Zweed schoot op de lat.

 Bevrijding door Clasie
Na lang aandringen kwam de bevrijdende treffer in de laatste minuut van de officiele speeltijd. Een afstandsschot van Jordy Clasie glipte door de handen van Cambuur-keeper João Virgínia. Door de overwinning heeft AZ nog altijd de 100% score. Aanstaande donderdag spelen de Alkmaarders weer, dan staat de inhaalwedstrijd tegen N.E.C. op het programma.

###

";35p862cizmkbm49ryyhjsafpw;ears40cp6opsgvhsy0dgyszpd;3kfktv64h7kg7zryax1wktr5r;SC Cambuur Leeuwarden;Alkmaar Zaanstreek;CAM;AZ;[['AZ', '3kfktv64h7kg7zryax1wktr5r', 1, 12, 'a2zavv31d2aadyddk0kjttdgq', 'M. Kerkez', 'YC'], ['Cambuur', 'ears40cp6opsgvhsy0dgyszpd', 1, 23, '426st78oi43eortpbfkuxw72t', 'M. Paulissen', 'YC'], ['Cambuur', 'ears40cp6opsgvhsy0dgyszpd', 2, 55, '9wgpudcet9m8doz9ezbjxzkrt', 'J. Jacobs', 'RC']];Cambuur Stadion;[['AZ', '3kfktv64h7kg7zryax1wktr5r', 2, 90, '7jgtmmk4b2bgn0syidj6ve7kl', 'J. Clasie']]
637230;;;TWE;EXC;4;0;2022-08-31Z;2022-23 Eredivisie, Regulier seizoen;Twente na vliegende start overtuigend langs Excelsior;"Enkele dagen na de nederlaag bij FC Volendam (1-0) heeft FC Twente zich in de Eredivisie hersteld door van Excelsior te winnen. Op eigen veld deed de subtopper dat met 4-0. Het was de derde overwinning in de competitie van de Enschedese formatie.

 Binnen de korte keren liep de thuisclub uit. Al in de eerste minuut scoorde Denilho Cleonise, na geknoei in de Rotterdamse defensie. Na 8 minuten werd het 2-0. Christos Tzolis schoot raak, na een combinatie met Ricky van Wolfswinkel.

 Excelsior op zoek naar aansluitingstreffer
Excelsior kreeg ook meerdere mogelijkheden. Zo redde doelman Lars Unnerstall bij een inzet van Julian Baas en had Reda Kharchouch in kansrijke positie te veel tijd nodig.

 Daardoor kon Twente verder uitlopen. Na ruim een uur maakte Vaclav Cerny er 3-0 van, op aangeven van back Gijs Smal. In extra tijd scoorde Cerny nogmaals.

 Twente niet compleet
Twente was niet compleet. Virgil Misidjan is vooralsnog door trainer Ron Jans uit de selectie gezet. Robin Pröpper, Michal Sadílek, Michel Vlap en Sem Steijn waren niet fit genoeg om mee te doen.

###

";34sl1m04nf2pjq1qrbgqwbkt0;4tic29sox7m39fy1ztgv0jsiq;dqk062lu0vm8epvytbm6r4mmf;FC Twente;SBV Excelsior;TWE;EXC;[];De Grolsch Veste;[['Twente', '4tic29sox7m39fy1ztgv0jsiq', 1, 1, '3940jh5ermawu3vbzbei6546i', 'D. Cleonise'], ['Twente', '4tic29sox7m39fy1ztgv0jsiq', 1, 8, 'acffs01m2p3b4uemzjrp51d9m', 'C. Tzolis'], ['Twente', '4tic29sox7m39fy1ztgv0jsiq', 2, 62, 'c1yctqdku2vzho2azsgcy5dcl', 'V. Černý'], ['Twente', '4tic29sox7m39fy1ztgv0jsiq', 2, 93, 'c1yctqdku2vzho2azsgcy5dcl', 'V. Černý']]
637231;;;FOR;UTR;3;4;2022-09-02Z;2022-23 Eredivisie, Regulier seizoen;Douvikas met hattrick grote man in tumultueus duel met Fortuna;"FC Utrecht heeft een tumultueus duel met Fortuna Sittard met 3-4 gewonnen. Anastasios Douvikas was de grote man voor Utrecht met een hattrick. Voor beide ploegen hing er veel van de wedstrijd af, aangezien de ambitieuze clubs slecht waren begonnen aan de competitie. In het treffen, dat werd ontsierd door ongeregeldheden in het stadion, was Utrecht uiteindelijk de sterkste door doelpunt van Bas Dost en dus drie treffers van Douvikas. Bij Fortuna waren Rodrigo Guth, Burak Yilmaz en Tijjani Noslin trefzeker.

 Dat het een duel onder hoogspanning was, bleek wel uit de eerste helft. Beide ploegen speelden zeer matig en creëerden amper kansen. De kansen die er waren, waren eerlijk verdeeld. George Cox haalde op heldhaftige wijze een bal van de lijn en Mats Seuntjes werd gevaarlijk met een poging van afstand.

 Ongeregeldheden

 In de tweede helft zakte het niveau naar een nieuw dieptepunt. Niet per se vanwege de spelers op het veld, maar vanwege de supporters op de tribune. Vanuit het uitvak vol met Utrecht-supporters werd er vuurwerk gegooid, naar nota bene Utrecht-spelers. De wedstrijd werd daarom kortstondig stilgelegd. Vlak daarna kon de wedstrijd worden hervat en kreeg Utrecht het overwicht op veld.

 Het werd al een aantal keer gevaarlijk en in de 64ste minuut was het, wie anders dan, Bas Dost die voor de 0-1 zorgde. Jens Toornstra verstuurde een fraaie pass in de richting van Moussa Sylla. De aanvaller tikte de bal richting Dost, die goed afwerkte. Lang kon Utrecht niet van de voorsprong genieten, want in de 67ste minuut werd het al weer 1-1. Mats Seuntjes legde een hoekschop op het hoofd van Rodrigo Guth, die knap raak kopte.

 Daarna bleef het boeiend in Sittard. Utrecht kwam, drie minuten na de 1-1, op 1-2. Othman Boussaid leek makkelijk te gaan liggen in het strafschopgebied, maar scheidsrechter Allard Lindhout vond het genoeg voor een penalty. Douvikas ging achter de bal staan en schoot onberispelijk binnen.

 Lindhout moest het duel na 72 minuten weer stilleggen nadat fans van Fortuna bierbekers op het veld hadden gegooid. Dit keer werden beide ploegen mee naar binnen genomen door Lindhout en werd het duel even stilgelegd.

 Krankzinnige slotfase

 Als er werd gevoetbald in de tweede helft, was het zeer leuk. Want het ging hard na de staking. In de 77ste minuut was het namelijk weer Douvikas die weer tot scoren kwam. Dit keer werd hij weggestuurd door Sean Klaiber, die dus een assists gaf bij zijn rentree in het Utrecht-shirt. Douvikas kapte zijn man uit en schoot fraai raak in de verre hoek.

 Natuurlijk mist er dan nog een treffer van Burak Yilmaz, en die kwam er dan ook. Toornstra kwam met een hoog been in bij Arianit Ferati en de bal verdween op de stip. Yilmaz ging achter de bal staan en maakte geen fout.

 De mooiste goal werd gemaakt in de 86ste minuut. Dost verlengde een voorzet op fraaie wijze en Douvikas schoot vervolgens schitterend zijn derde van de wedstrijd binnen.

 Daarmee was de koek nog niet op, want Fortuna kwam diep in blessuretijd nog op 3-4. Tijjani Noslin won een duel van Django Warmerdam, die zwak verdedigde, en kon oog-in-oog met Vasilios Barkas scoren.

 Daar bleef het in een krankzinnige tweede helft bij. Utrecht boekt zijn eerste zege van het seizoen en komt na vijf wedstrijden op vijf punten, Fortuna Sittard is na vijf wedstrijd nog altijd puntloos.

###

";35splt3x71cp9b8qpfa6bexw4;3ebril33e08ddzob4bhq8awsr;ccpscwdcm65czscrun048ecn5;Fortuna Sittard;FC Utrecht;FOR;UTR;[['Fortuna Sittard', '3ebril33e08ddzob4bhq8awsr', 2, 71, '4e6yz7j1xjd7b6oyv078q8edx', 'M. Tirpan', 'YC'], ['Utrecht', 'ccpscwdcm65czscrun048ecn5', 2, 81, 'ely6vpyueden4b6ozfmspwgk5', 'J. Toornstra', 'YC'], ['Utrecht', 'ccpscwdcm65czscrun048ecn5', 2, 83, '1s7vp9ovsa1jo7tu7nisykn9x', 'M. van der Maarel', 'YC']];Fortuna Sittard Stadion;[['Utrecht', 'ccpscwdcm65czscrun048ecn5', 2, 64, '395y7yj6o1xwr6uaxs4sjnjdh', 'B. Dost'], ['Fortuna Sittard', '3ebril33e08ddzob4bhq8awsr', 2, 67, '9fpb7g8ij9dqtuqhnimy5fap5', 'Rodrigo Guth'], ['Utrecht', 'ccpscwdcm65czscrun048ecn5', 2, 70, '1p0xp2onnys7jlru55vfgf1pm', 'T. Douvikas'], ['Utrecht', 'ccpscwdcm65czscrun048ecn5', 2, 77, '1p0xp2onnys7jlru55vfgf1pm', 'T. Douvikas'], ['Fortuna Sittard', '3ebril33e08ddzob4bhq8awsr', 2, 82, '8rqula41yqtbwycgemsw9ixud', 'B. Yılmaz'], ['Utrecht', 'ccpscwdcm65czscrun048ecn5', 2, 86, '1p0xp2onnys7jlru55vfgf1pm', 'T. Douvikas'], ['Fortuna Sittard', '3ebril33e08ddzob4bhq8awsr', 2, 97, '71gwdg60saiwwwnnv6is52may', 'T. Noslin']]
637232;;;AJA;CAM;4;0;2022-09-03Z;2022-23 Eredivisie, Regulier seizoen;Bergwijn neemt winnend Ajax bij de hand;"Ajax heeft vanmiddag de thuiswedstrijd tegen SC Cambuur met 4-0 gewonnen. Steven Bergwijn vertolkte een hoofdrol voor de kampioen. De vleugelaanvaller toonde opnieuw zijn klasse en was belangrijk met twee doelpunten.

 Ajax met Klaassen, drie nieuwelingen op de bank
Ajax begon met Edson Álvarez en Davy Klaassen in de ploeg aan de thuiswedstrijd tegen de Friezen. De middenvelder uit Mexico kreeg deze week van de clubleiding geen toestemming voor een transfer naar Chelsea. Álvarez was daar zo teleurgesteld over dat hij een training oversloeg. De basisplaats van Klaassen ging ten koste van Kenneth Taylor, hij startte op de bank, net als de aanwinsten Lucas Ocampos, Florian Grillitsch en Ahmetcan Kaplan.

 Cambuur voerde drie wijzigingen door ten opzichte van de laatste wedstrijd. Daniël van Kaam, Jasper ter Heide en Michael Breij stonden in de basis, wat ten koste ging van Mees Hoedemakers, Jamie Jacobs en David Sambissa. Hoedemakers is geblesseerd, Jacobs geschorst en Sambissa gepasseerd. Hij begon op de bank.

 Stroeve openingsfase
De eerste kans in de Johan Cruijff Arena was voor Cambuur, maar Michael Breij schoot over na goed werk van spits Roberts Uldrikis. De Amsterdammers hadden in de eerste helft grote moeite om tot uitgespeelde kansen te komen. Na een half uur spelen had Ajax nog geen bal op doel geschoten.

 In minuut 35 was daar dan toch de openingstreffer voor Ajax. Na een passje van Dusan Tadic, die zijn 200e wedstrijd speelde voor Ajax, gaf Steven Berghuis voor. De bal werd aangeraakt, maar Bergwijn was er snel genoeg bij om de 1-0 binnen te tikken. Vijf minuten later was het opnieuw Bergwijn die scoorde. De Oranje-international haalde verwoestend uit en verdubbelde zo de voorsprong: 2-0.

 Steven Bergwijn zet Ajax met een fantastisch afstandsschot op een 2-0 voorsprong tegen SC Cambuur.

 Invallers beslissen duel
In de rust een dubbele wissel bij Ajax. Mohamed Kudus en Kenneth Taylor kwamen halverwege in de ploeg voor Alvarez en Brobbey. Een kleine tien minuten na zijn invalbeurt beloonde Taylor zichzelf met een doelpunt. De 20-jarige middenvelder liet Cambuur-keeper João Virginia kansloos met een schot van afstand.

 In de 64e minuut opnieuw een invaller die scoorde voor Ajax. Kudus pakte zijn goal mee na een voorzet van Calvin Bassey: 4-0. Tien minuten voor tijd maakte Lucas Ocampos zijn debuut voor Ajax. De van Sevilla gehuurde Argentijn kwam erin voor Tadic. Jurriën Timber maakte plaats voor Jorge Sánchez. Gescoord werd er niet meer en dus boekte Ajax zijn vijfde overwinning op rij in de Eredivisie.

 Afwezigheid Wijndal
Owen Wijndal mist woensdagavond de thuiswedstrijd van Ajax tegen Rangers FC in de Champions League. De linksback heeft nog te veel last van een enkelblessure. ""Die wedstrijd komt helaas te vroeg voor hem"", zei trainer Ajax-trainer Alfred Schreuder na de soepele competitiezege op Cambuur.

###

";35wtbgqtw53y29u7uaoh95xjo;d0zdg647gvgc95xdtk1vpbkys;ears40cp6opsgvhsy0dgyszpd;AFC Ajax;SC Cambuur Leeuwarden;AJA;CAM;[['Ajax', 'd0zdg647gvgc95xdtk1vpbkys', 1, 44, 'bp3apdb2ahzacq45k4mzj5jhl', 'E. Álvarez', 'YC'], ['Cambuur', 'ears40cp6opsgvhsy0dgyszpd', 1, 44, '426st78oi43eortpbfkuxw72t', 'M. Paulissen', 'YC'], ['Cambuur', 'ears40cp6opsgvhsy0dgyszpd', 1, 44, 'e1wk520xrgbtriixo4kj3pnje', 'R. Balk', 'YC']];Johan Cruijff Arena;[['Ajax', 'd0zdg647gvgc95xdtk1vpbkys', 1, 35, '6hrp4zuxh40i3tccmk5s0j5xx', 'S. Bergwijn'], ['Ajax', 'd0zdg647gvgc95xdtk1vpbkys', 1, 40, '6hrp4zuxh40i3tccmk5s0j5xx', 'S. Bergwijn'], ['Ajax', 'd0zdg647gvgc95xdtk1vpbkys', 2, 53, '6sg2ot7z9kfyrlgjkmpqvejqi', 'D. Rensch'], ['Ajax', 'd0zdg647gvgc95xdtk1vpbkys', 2, 64, 'p7vw4thx5wzo49h6hfabcq5m', 'M. Kudus']]
637233;;;TWE;PSV;2;1;2022-09-03Z;2022-23 Eredivisie, Regulier seizoen;Ontketende Cerny levert zwak PSV eerste nederlaag op;"Opnieuw heeft PSV niet weten te winnen in de Grolsch Veste. Het elftal van Ruud van Nistelrooij kwam met name voor rust zeer zwak voor de dag, terwijl FC Twente uit de startblokken schoot. Met twee doelpunten in de eerste helft werd Vaclav Cerny de man van de wedstrijd. Til deed na rust nog wat terug, maar kon de Eindhovenaren niet behoeden voor de eerste nederlaag van het seizoen: FC Twente – PSV werd 2-1.

 De laatste jaren hebben de Eindhovenaren het steeds lastig in de Grolsch Veste: de laatste drie edities in de Eredivisie eindigden allemaal in een gelijkspel. Vorig jaar kwam PSV nog terug van een 3-0 achterstand en werd het 3-3.

 Slechte start
De bezoekers creëerden geen enkele kans en moesten voornamelijk verdedigen. Het was niet lastig om de man van de eerste helft aan te wijzen: Cerny was vanaf het eerste moment lastig voor de PSV-defensie. En dat goede begin van Cerny werd beloond: in de zeventiende minuut knalde hij de 1-0 tegen de touwen. 

 Nog geen tien minuten later maakte de Tsjech al zijn tweede van de avond. Na geklungel in de defensie bij PSV, was het voor Cerny een koud kunstje om de 2-0 achter Benitez te schieten. Zo maakte Cerny zijn vierde doelpunt van de week: midweeks maakte hij al twee treffers tegen Excelsior.

 Václav Cerny maakt op heerlijke wijze zijn tweede van de avond en zet FC Twente op 2-0 tegen PSV.

 Pas aan het eind van de eerste helft kreeg PSV zijn eerste kans van de avond: Cody Gakpo kon zo op Lars Unnerstall aflopen, maar ook dit seizoen is de Duitse doelman in vorm. Het was de enige kans moment waaraan PSV-fans hoop voor een betere tweede helft konden vestigen.

 Aansluitingstreffer
Het begin na rust was nog niet fantastisch van PSV, maar de Tukkers konden niet meer brengen wat zij voor rust deden. Net op het moment dat de Eindhovenaren de weg naar voren steeds meer vonden, profiteerde Guus Til daar direct van: 2-1. Ruud van Nistelrooij wisselde hem meteen na de treffer waardoor Anwar El Ghazi zijn debuut maakte.

 Het lukte de ploeg van Van Nistelrooij niet om na de aansluitingstreffer door te drukken. Pas in de blessuretijd werd de druk opgevoerd, maar een treffer werd er niet meer gemaakt. Na vier overwinningen levert de uitwedstrijd in Enschede PSV dus het eerste puntenverlies van het seizoen op.

###

";360mpijrk8jtevxmfkt11t2c4;4tic29sox7m39fy1ztgv0jsiq;24fvcruwqrqvqa3aonf8c3zuy;FC Twente;PSV Eindhoven;TWE;PSV;[['Twente', '4tic29sox7m39fy1ztgv0jsiq', 1, 27, 'lduqoe45t2fnbn9s9rbvlnf9', 'R. Pröpper', 'YC'], ['PSV', '24fvcruwqrqvqa3aonf8c3zuy', 2, 74, '5mbkc1nqmirbtfml9aklqr5xx', 'P. Max', 'YC'], ['PSV', '24fvcruwqrqvqa3aonf8c3zuy', 2, 76, '1abb1gcw7arw1nkbuxnccjca1', 'I. Sangaré', 'YC']];De Grolsch Veste;[['Twente', '4tic29sox7m39fy1ztgv0jsiq', 1, 17, 'c1yctqdku2vzho2azsgcy5dcl', 'V. Černý'], ['Twente', '4tic29sox7m39fy1ztgv0jsiq', 1, 24, 'c1yctqdku2vzho2azsgcy5dcl', 'V. Černý'], ['PSV', '24fvcruwqrqvqa3aonf8c3zuy', 2, 55, '21k54i5a6d9bi4f6gplgzxiw9', 'G. Til']]
637234;;;SPA;VOL;4;0;2022-09-03Z;2022-23 Eredivisie, Regulier seizoen;Sparta boekt spectaculaire zege op Volendam;"Sparta Rotterdam heeft vanavond de thuiswedstrijd tegen FC Volendam met 4-0 gewonnen. Tobias Lauritsen vertolkte een hoofdrol met twee treffers. Ook doelman Nick Olij liet zich gelden met een mooie assist.

 Auassar op de bank, Mühren opnieuw achter Veerman
Sparta wijzigde de formatie op twee posities ten opzichte van de vorige wedstrijd. Aanvoerder Adil Auassar werd tegen FC Volendam verrassend vervangen door Mike Eerdhuijzen. Hij speelde dus tegen zijn oude club. Op het middenveld nam Arno Verschueren de plaats van Sven Mijnans in. Bij FC Volendam stond Henk Veerman weer in de spits, met achter hem Robert Mühren.

 Kansrijke openingsfase
Sparta en Volendam schoten uit de startblokken op Het Kasteel. Mühren kreeg meteen een goede kans, maar Nick Olij bracht redding. Vlak erna een kans voor Veerman, maar wederom lag Olij in de weg. Na acht minuten kreeg ook Sparta zijn eerste kans. Tobias Lauritsen had de 1-0 op zijn schoen. De spits kwam alleen voor doelman Filip Stankovic, maar hij bracht knap redding.

 Na veertien minuten nam Sparta de leiding. Doelman Olij schoot de bal bij een uittrap heel ver naar voren, waarna Vito van Crooij het karwei afmaakte. Het spel ging vervolgens over en weer. Op slag van rust kreeg Volendam een levensgrote kans. Mühren leek de bal voor het intikken te hebben, maar de bal verdween op miraculeuze wijze naast het doel van Sparta. Gezien de vele kansen was het een wonder dat er niet meer goals vielen in de eerste helft.

 Lauritsen beslist duel met kopbal
Ook na rust waren er voldoende kansen te noteren. Waar Henk Veerman de bal over schoot namens de bezoekers was het kort daarna Vito van Crooij die bijna zijn tweede goal van de avond maakte. Keeper Filip Stankovic lag in de weg. In de 68e minuut verdubbelde Sparta de voorsprong. Op doorzettingsvermogen kreeg Saito de bal bij Pinto. De Luxemburger speelde Mijnans aan die de bal met een hakje mee gaf aan Pinto. Vervolgens gaf de linksback een goede voorzet, waarna Lauritsen zijn tweede van het seizoen binnen kopte.

 Een paar minuten later was het opnieuw raak. Weer wisten Saito en Pinto elkaar goed te bereiken. Dit keer gaf Saito voor, waarna wederom Lauritsen scoorde: 3-0. Mijnans gooide vijf minuten voor tijd nog wat extra zout in de Volendamse wond. Hij schoot de 4-0 binnen voor de ploeg van trainer Maurice Steijn. Sparta boekt de tweede competitiezege op rij.

###

";364fmyhpf2bl1492uspu9k4r8;89w5c6pw7vn0dxypi61tt0g4k;6g9qrm72224jrk6tkxxxi8a9n;Sparta Rotterdam;FC Volendam;SPA;VOL;[];Sparta-Stadion Het Kasteel;[['Sparta Rotterdam', '89w5c6pw7vn0dxypi61tt0g4k', 1, 14, '2nwthqvbk70e2qo35dgp35979', 'V. van Crooij'], ['Sparta Rotterdam', '89w5c6pw7vn0dxypi61tt0g4k', 2, 68, '6q77vt9bp8dsq48pa97mfzsa1', 'T. Lauritsen'], ['Sparta Rotterdam', '89w5c6pw7vn0dxypi61tt0g4k', 2, 72, '6q77vt9bp8dsq48pa97mfzsa1', 'T. Lauritsen'], ['Sparta Rotterdam', '89w5c6pw7vn0dxypi61tt0g4k', 2, 85, '7jpreaads35pnnfqbn7hmrmy', 'S. Mijnans']]
637235;;;GAE;FEY;3;4;2022-09-03Z;2022-23 Eredivisie, Regulier seizoen;Feyenoord neemt ondanks dramatische start drie punten mee uit Deventer;"In een heerlijk voetbalgevecht in De Adelaarshorst is het Feyenoord gelukt om drie punten mee terug naar Rotterdam te nemen. Go Ahead Eagles had er niet lang voor nodig om op een 2-0 voorsprong te komen, maar nog voor rust kon Feyenoord de schade repareren. Na de thee zorgde Javairô Dilrosun en een werelddoelpunt van Sebastian Szymanski dat de Rotterdammers – ondanks de slechte start – wonnen. In de blessuretijd maakte Edvardsen nog de 3-4.

 Snelle voorsprong
Het is hét verhaal van de eerste speelrondes van de Eredivisie: clubs die uit de startblokken schieten door snel te scoren. Ook Go Ahead Eagles doet zaterdagavond een duit in het zakje: al in de derde minuut beland een schot van Evert Linthorst met het nodige geluk in het doel: 1-0.

 Het elftal van Arne Slot begon net als PSV eerder op de avond zeer matig aan de wedstrijd. Eagles profiteerde daar optimaal van, want binnen een kwartier werd de voorsprong al verdubbeld. Isac Lidberg kopte een perfecte voorzet van Bobby Adekanye binnen: 2-0.

 12' - Doelpunt Isac Lidberg. Go Ahead Eagles - Feyenoord 2-0

 Danilo
Het was wat laat, maar de tweede treffer van het elftal van René Hake was voor Feyenoord een wake up call. De Braziliaanse spits Danilo van de Rotterdammers maakte halverwege de eerste helft de belangrijke aansluitingstreffer: 2-1. Zonder heel goed te spelen werd Feyenoord naar mate de eerste helft vorderde wel steeds beter.

 Vlak voor het rustsignaal was het diezelfde Danilo zijn vijfde doelpunt van het seizoen en daarmee de 2-2. Voor Go Ahead Eagles kwam de rust als geroepen. In de rust liet Slot Marcus Pedersen in de kleedkamer en werd hij vervangen door Mimeirhel Benita. Bij Eagles maakte de veelbesproken Sylla Sow zijn opwachting.

 Sterker Feyenoord
Ondanks de slechte start van Feyenoord lukte het de ploeg van Slot wel om op voorsprong te komen: Javairo Dilrosun werkte goed af en schoot de 2-3 binnen. Feyenoord kwam daarna niet meer in de problemen, maar maakte Szymanski in de slotfase op grandioze wijze de 2-4. Hij schoot prachtig in de kruising. In de allerlaatste minuut maakte Edvardsen nog de 3-4 namens Go Ahead Eagles, maar dat mocht niet meer baten.

 Door de overwinning stijgen de Rotterdammers naar de tweede plek in de Eredivisie. Go Ahead Eagles wacht na vijf speelrondes nog altijd op het eerste punt.

###

";368207nya9n0kjo03p65mwglw;b79uipsy57y1jqpy07h4i5ovk;20vymiy7bo8wkyxai3ew494fz;Go Ahead Eagles;Feyenoord Rotterdam;GAE;FEY;[];De Adelaarshorst;[['Feyenoord', '20vymiy7bo8wkyxai3ew494fz', 1, 3, '1957std7hji9ca7bd29y8at7u', 'P. Wålemark'], ['Go Ahead Eagles', 'b79uipsy57y1jqpy07h4i5ovk', 1, 13, 'hxqybxg5578sgx0gx5qb834l', 'I. Lidberg'], ['Feyenoord', '20vymiy7bo8wkyxai3ew494fz', 1, 24, '4j5hfebi948ggjwexpndrub1m', 'Danilo'], ['Feyenoord', '20vymiy7bo8wkyxai3ew494fz', 1, 42, '4j5hfebi948ggjwexpndrub1m', 'Danilo'], ['Feyenoord', '20vymiy7bo8wkyxai3ew494fz', 2, 56, 'dy8wa8cciiae72q2ynm80rlcl', 'J. Dilrosun'], ['Feyenoord', '20vymiy7bo8wkyxai3ew494fz', 2, 79, '504o2odlvra056ouwcgreopgp', 'S. Szymański'], ['Go Ahead Eagles', 'b79uipsy57y1jqpy07h4i5ovk', 2, 96, '7dkhv2l8y6jq20l1dc2ye17je', 'O. Edvardsen']]
