espn_id;home_team;away_team;home_abbrev;away_abbrev;score_home;score_away;date;cup;article_title;article;id;homeContestantId;awayContestantId;homeContestantOfficialName;awayContestantOfficialName;homeContestantCode;awayContestantCode;card_events;venue;goal_events
637361;;;AZ;UTR;5;5;2023-01-28Z;2022-23 Eredivisie, Regulier seizoen;AZ en FC Utrecht zorgen met tien goals voor groot voetbalfeest;"AZ en FC Utrecht hebben in een groot spektakelstuk gelijkgespeeld. Met tien goals werd het maar liefst 5-5. Door het gelijkspel komt AZ op 40 punten. Dat is een punt minder dan Feyenoord, dat morgen nog in actie komt tegen FC Twente. FC Utrecht blijft zevende met 30 punten.  

 In de 1900e competitiewedstrijd van AZ speelde het thuis tegen FC Utrecht. Maxim Dekker mocht naast Pantelis Hatzidiakos centraal in de verdediging starten. Ook bij FC Utrecht was er een wijziging. Bas Dost reisde niet af naar Alkmaar. Hij ontbrak wegens een blessure.

 Douvikas liet zich gelijk gelden in de wedstrijd en wist na een kwartier spelen alle aandacht op zich te vestigen. Na een counter die FC Utrecht knap opbouwde, schoot hij zijn club naar een 0-1 voorsprong. Even later liet hij de supporters van FC Utrecht voor een tweede keer juichen. Douvikas scoorde opnieuw en verdubbelde de voorsprong in het AFAS Stadion.

 Een waar voetbalfeest
Maar na de twee doelpunten van FC Utrecht toonde AZ veerkracht en ging het voor een comeback. Het knokte zich binnen vijftien minuten naar een 3-2 voorsprong. Het zijn de vervangers in deze wedstrijd die zich in deze wedstrijd lieten gelden, want aan de kant van AZ is het verdediger Maxim Dekker die in de twintigste minuut de aansluitingstreffer maakt. De gelijkmaker voor AZ wordt na een halfuur spelen door Pavlidis overtuigend binnen geschoten na een rebound. De spits brengt drie minuten later de fans opnieuw in extase. Na een voorzet nam hij de bal aan op de borst, waardoor hij ruimte voor zichzelf creëerde en van dichtbij keeper Ryan kon passeren.

 De aanwezige supporters kregen geen tijd om op adem te komen tijdens deze wedstrijd. Het is Nick Viergever die zijn oude club pijn deed. Hij bracht vijf minuten voor het rustsignaal nog maar eens de gelijke stand op het scorebord. AZ kreeg nog een tegenslag te verwerken. Maxim Dekker raakte geblesseerd en werd direct vervangen voor Zinho Vanheusden. Beide ploegen zorgde in de eerste helft voor een waar doelpuntenfestijn en een voetbalfeest.

 Hattrick
In de tweede helft volgde de eerste grote kans na een kwartier spelen. FC Utrecht kwam er na een steekpass, met een luchtje buitenspel, goed uit. Het was Douvikas die de bal schitterend over keeper Ryan heen wipte en de bal in het doel kon werken. Maar na een kort VAR-moment blijkt de spits inderdaad buitenspel te staan. Douvikas bleef een plaaggeest voor de verdediging van AZ. In de 66ste minuut lukte het de Griek om zijn hattrick te voltooien.

 Goals, goals en nog meer goals
Het lukt beide ploegen niet om voor een langere tijd een voorsprong vast te houden. AZ-speler Mees de Wit stond net tien minuten binnen de lijnen en wist de 4-4 voor zijn rekening te nemen. De Domstedelingen bleven aandringen aan gingen opzoek naar een voorsprong. Dat zorgde voor een grote kansen in de zestien van de tegenstander. Met een bal op de paal en later een mooi afstandsschot, wist FC Utrecht niet op voorsprong te komen.

 Oneindige spektakelstuk
Het spektakel kwam maar niet tot zijn einde in Alkmaar. Na het vele aandringen van Utrecht was het Pavlidis die ook zijn hattrick wist te maken en AZ naar 5-4 schoot. Maar het vashouden van de voorsprong was voor beide ploegen een probleem in deze wedstrijd. De Alkmaarders konden twee minuten genieten van de voorsprong. FC Utrecht wist de bal naar voren te werken. Sander van de Streek kopte de bal in het doel. Daarbij kwam hij op een vervelende manier in botsing met keeper Ryan. De middenvelder hoefde niet gewisseld te worden en kon de wedstrijd uitspelen. Van de Streek zorgde voor een goalproductie van tien doelpunten in deze wedstrijd.

 In de slotfase gingen beide ploegen voor de winst. Het winnende doelpunt kwam er uiteindelijk niet meer. Het voetbalfeest dat AZ en FC Utrecht voorschotelde, eindigde in 5-5.

###

";3k3c8ppr0t616c1ywl42b4bh0;3kfktv64h7kg7zryax1wktr5r;ccpscwdcm65czscrun048ecn5;Alkmaar Zaanstreek;FC Utrecht;AZ;UTR;[['Utrecht', 'ccpscwdcm65czscrun048ecn5', 2, 92, 'c2an5ksdu6jbap3x3jp3z9c5x', 'N. Viergever', 'YC']];AFAS Stadion;[['Utrecht', 'ccpscwdcm65czscrun048ecn5', 1, 12, '1p0xp2onnys7jlru55vfgf1pm', 'T. Douvikas'], ['Utrecht', 'ccpscwdcm65czscrun048ecn5', 1, 16, '1p0xp2onnys7jlru55vfgf1pm', 'T. Douvikas'], ['AZ', '3kfktv64h7kg7zryax1wktr5r', 1, 20, '6zzcoo9k4ebqtlux49rbb5fro', 'M. Dekker'], ['AZ', '3kfktv64h7kg7zryax1wktr5r', 1, 30, '7sd87ylfbtgwgpb70hf68cel1', 'V. Pavlidis'], ['AZ', '3kfktv64h7kg7zryax1wktr5r', 1, 34, '7sd87ylfbtgwgpb70hf68cel1', 'V. Pavlidis'], ['Utrecht', 'ccpscwdcm65czscrun048ecn5', 1, 41, 'c2an5ksdu6jbap3x3jp3z9c5x', 'N. Viergever'], ['Utrecht', 'ccpscwdcm65czscrun048ecn5', 2, 65, '1p0xp2onnys7jlru55vfgf1pm', 'T. Douvikas'], ['AZ', '3kfktv64h7kg7zryax1wktr5r', 2, 70, '3uq3lrjyj4mnvq6162b0jyhnt', 'M. de Wit'], ['AZ', '3kfktv64h7kg7zryax1wktr5r', 2, 78, '7sd87ylfbtgwgpb70hf68cel1', 'V. Pavlidis'], ['Utrecht', 'ccpscwdcm65czscrun048ecn5', 2, 80, '4rp5snknt88bf4lws5t0o9gph', 'S. van de Streek']]
637362;;;TWE;FEY;1;1;2023-01-29Z;2022-23 Eredivisie, Regulier seizoen;Twente en Feyenoord houden elkaar in bedwang in enerverende topper;"FC Twente en Feyenoord hebben elkaar zondag in een vermakelijke topper in evenwicht gehouden. In De Grolsch Veste kwam koploper Feyenoord in de eerste helft op voorsprong door een doelpunt van Santiago Giménez, maar Twente wist na rust via Joshua Brenet alsnog langszij te komen: 1-1.

 Bij de ploeg van trainer Ron Jans keerden Brenet en Michal Sadílek terug in de basisopstelling, terwijl Giménez bij Feyenoord in de spits de voorkeur kreeg boven Danilo, die tegen zijn oude club op de bank moest plaatsnemen.

 Twente en Feyenoord begonnen fel aan het duel met veel druk op de bal. Dat resulteerde in een openingsfase met kansen voor beide ploegen. Eerst reageerde FC Twente-doelman Lars Unnerstall goed op een inzet van Feyenoord-middenvelder Sebastian Szymanski, waarna Robin Pröpper aan de andere kant bijna een indraaiende voorzet van Ramiz Zerrouki bij de eerste paal binnenwerkte.

 Virgil Misidjan kreeg niet veel later een enorme kans om de score te open voor Twente. Michal Sadílek stuurde Joshua Brenet weg langs de lijn. Brenet bediende vervolgens Misidjan, maar die schoot zonder overtuiging op doel waardoor Feyenoord-doelman Justin Bijlow alsnog kon ingrijpen.

 Openingstreffer
Aan de andere kant was het vijf minuten later wel raak voor Feyenoord. Santiago Giménez ontving de bal van Orkun Kökcü in het zestienmetergebied en legde goed af op Szymanski, die vervolgens de bal bij de tweede paal neerlegde voor de doorgelopen Giménez. Met een strakke kopbal brak de Mexicaanse spits vervolgens met zijn eerste doelpunt als basisspeler de ban: 0-1.

 Bijlow ontving aan het einde van de eerste helft nog een opmerkelijke gele kaart. De 25-jarige sluitpost kwam ver uit om een pass op Misidjan te onderscheppen en gooide vervolgens de bal bij de zijlijn weer terug het veld in. Misidjan gooide vervolgens een andere bal naar Bijlow, maar de buitenspeler van Twente ontsnapte dan weer aan een gele kaart.

 Langszij
Twente keek voor het eerst dit Eredivisie-seizoen thuis op een achterstand aan en moest in de tweede helft iets zien te forceren. Dat lukte uiteindelijk in de 68e minuut door een rake kopbal van Brenet na een voorzet van Sadilek. De 28-jarige vleugelverdediger torende boven Quilindschy Hartman en Alireza Jahanbakhsh uit en knikte zijn ploeg langszij: 1-1.

 Beide ploegen kwamen in het laatste kwart van de wedstrijd niet meer tot scoren. Grote kansen waren er nog wel voor Feyenoord-invaller Oussama Idrissi en Twente-aanvaller Vaclav Cerny, maar dat resulteerde niet in beslissend doelpunt. Zo gaat Feyenoord met een totaal van 42 punten nog altijd aan kop in de Eredivisie, met een voorsprong van twee punten op nummer twee AZ. Twente blijft op de vierde plek staan met 36 punten.

###

";3k73guco62o3ddi2jaaa8ecd0;4tic29sox7m39fy1ztgv0jsiq;20vymiy7bo8wkyxai3ew494fz;FC Twente;Feyenoord Rotterdam;TWE;FEY;[['Feyenoord', '20vymiy7bo8wkyxai3ew494fz', 1, 38, '9pgr69ub37hmr76gwbfw7lhw5', 'J. Bijlow', 'YC'], ['Twente', '4tic29sox7m39fy1ztgv0jsiq', 2, 66, 'lduqoe45t2fnbn9s9rbvlnf9', 'R. Pröpper', 'YC'], ['Feyenoord', '20vymiy7bo8wkyxai3ew494fz', 2, 75, '4fcjml5xkrwp4jykruzrzub1m', 'Q. Hartman', 'YC'], ['Twente', '4tic29sox7m39fy1ztgv0jsiq', 2, 81, 'dc119ejc7lls2rd3ywigl2smi', 'R. Zerrouki', 'YC']];De Grolsch Veste;[['Feyenoord', '20vymiy7bo8wkyxai3ew494fz', 1, 30, 'aboxil79ulfa73pckzsdnwp62', 'S. Giménez'], ['Twente', '4tic29sox7m39fy1ztgv0jsiq', 2, 68, '6p4fs5rivwt0e45twlsf6ajth', 'J. Brenet']]
637363;;;EXC;AJA;1;4;2023-01-29Z;2022-23 Eredivisie, Regulier seizoen;Ajax onder Heitinga weet eindelijk weer te winnen in de Eredivisie: Excelsior over de knie;"In Kralingen heeft Ajax eindelijk weer eens een competitiezege bij kunnen schrijven: Excelsior werd door doelpunten van Dusan Tadic, Davy Klaassen en Mohammed Kudus en Devyne Rensch met 1-4 verslagen. Redouan El Yaakoubi maakte een doelpunt namens de thuisploeg.

 Slordig Ajax tegen de verhouding op voorsprong
John Heitinga kreeg namens directeur Edwin van der Sar de taak om de honeurs - in ieder geval dit weekend - over te nemen van Alfred Schreuder. Na het gelijkspel tegen FC Volendam werd Schreuder nog op de avond zelf ontslagen. Ondanks dat het spel - zeker voor rust - nog erg slordig was, weten de Amsterdammers wel weer eens te winnen in de Eredivisie.

 Excelsior kwam sterk uit de startblokken en leek geen moment onder de indruk van de landskampioen. De grootste kansen waren voor rust ook voor de Kralingers. Na ruim een kwartier kreeg Ajax een strafschop waarbij Tadic doelman Stijn van Gassel de verkeerde hoek in stuurde.

 Klaassen opnieuw maker belangrijk doelpunt
El Yaakoubi kopte een kwartier later na een goede voorzet van Couhaib Driouech de verdiende gelijkmaker binnen. Dat Ajax met een voorsprong ging rusten mag een klein wonder genoemd worden, opnieuw was Klaassen de maker van een zeer belangrijk doelpunt.

 Ajax kwam in de tweede helft beter voor de dag. Kudus en Rensch maakte twee prachtige doelpunten met schoten van grote afstand. Zo doet het Ajax onder leiding van Heitinga goede zaken op de ranglijst doordat FC Twente en Feyenoord eerder op de dag met 1-1 gelijkgespeeld hebben. De Amsterdammers klimmen een plekje - naar de vierde plek - en staan vijf punten achter koploper Feyenoord.


###

";3kaxuz5cdxb8lsmnwwbed8cgk;dqk062lu0vm8epvytbm6r4mmf;d0zdg647gvgc95xdtk1vpbkys;SBV Excelsior;AFC Ajax;EXC;AJA;[['Ajax', 'd0zdg647gvgc95xdtk1vpbkys', 2, 58, 'bp3apdb2ahzacq45k4mzj5jhl', 'E. Álvarez', 'YC'], ['Excelsior', 'dqk062lu0vm8epvytbm6r4mmf', 2, 59, '6jhavdnaitqn6ydme8a526aui', 'C. Driouech', 'YC']];Van Donge & De Roo Stadion;[['Ajax', 'd0zdg647gvgc95xdtk1vpbkys', 1, 15, '6m2pk6odyb3atayt6u8cifahh', 'D. Tadić'], ['Excelsior', 'dqk062lu0vm8epvytbm6r4mmf', 1, 36, '934ldgpefo90za10cq49k0o6i', 'R. El Yaakoubi'], ['Ajax', 'd0zdg647gvgc95xdtk1vpbkys', 1, 45, 'baakmd4ndnulbl9npvmq90mvp', 'D. Klaassen'], ['Ajax', 'd0zdg647gvgc95xdtk1vpbkys', 2, 61, 'p7vw4thx5wzo49h6hfabcq5m', 'M. Kudus'], ['Ajax', 'd0zdg647gvgc95xdtk1vpbkys', 2, 83, '6sg2ot7z9kfyrlgjkmpqvejqi', 'D. Rensch']]
637364;;;VOL;GRO;3;2;2023-01-29Z;2022-23 Eredivisie, Regulier seizoen;Volendam wint doelpuntrijke degradatiekraker en duwt Groningen verder in de problemen;"FC Volendam heeft goede zaken gedaan in de strijd tegen degradatie. De ploeg van Wim Jonk versloeg het ploeterende FC Groningen met 3-2

 De bezoekers hadden licht overwicht in het eerste kwartier, met twee kansen voor Liam van Gelderen en Ricardo Pepi. Maar het schot van de rechtsback, en de kopbal van de spits gingen allebei naast. Toch was het de thuisclub die na 21 minuten op voorsprong kwam. Na geklungel achterin omspeelde Gaetano Oristanio doelman Michael Verrips, en schoof de bal in het lege doel.

 Volendamse storm 
Direct daarna werden de Volendammers sterker, een schot van Robert Mühren ging via een Gronings been voorlangs, uit de daaropvolgende corner kopte Damon Mirani over. Vijf minuten later volgde een razendsnelle solo van Derry John Murkin, maar de linksback vond Verrips op zijn weg. Ondanks de Volendamse storm zochten beide ploegen met de 1-0 tussenstand de kleedkamers op.

 Na rust kwamen de Groningers razendsnel op gelijke hoogte. Uit een scrimmage na een corner schoot de nieuwe Noorse middenvelder Johan Hove de bal tegen de touwen. Het is precies waarom FC Groningen hem haalde, als middenvelder scoorde hij vorig seizoen tien goals in 29 wedstrijden in de Noorse competitie.

 Snel antwoord Volendam 
Lang kon de ploeg van Dennis van der Ree niet genieten van de voorsprong. Uit een afslagen vrije trap bracht Florent da Silva de bal opnieuw in, en kon de helemaal vrijstaande Calvin Twigt van dichtbij binnenkoppen. De buitenspeler, die morgen 20 wordt, maakte afgelopen donderdag tegen Ajax zijn Eredivisiedebuut.

 Twintig minuten voor tijd kwam FC Groningen uit het niets weer op gelijke hoogte. Ricardo Pepi ontsnapte aan de Volendamse verdediging en schoot de bal via doelman Filip Stankovic raak. Het was voor de Amerikaanse spits eindelijk zijn eerste doelpunt na de winterstop. Maar ook nu hielden de bezoekers de gelijke stand niet lang vast. Dertien minuten voor tijd kon Mühren een afgeslagen voorzet van Oristiano op de achterlijn binnentikken. Voor FC Groningen was het alweer de zeventiende tegentreffer in het laatste kwartier van een Eredvisieduel dit seizoen.

 Nacompetitiestreep
Vijf minuten voor tijd was Tomáš Suslov namens de bezoekers nog dichtbij. Maar Stanković haalde de vrije trap van de Slowaak knap uit de hoek. Door de overwinning staat Volendam nu voor het eerst sinds lange tijd boven de nacompetitiestreep. FC Groningen staat onderaan.

###

";3keqmxapzq2xlm4y2xy0oeh3o;6g9qrm72224jrk6tkxxxi8a9n;cos9hxi16eitbcbthof7zrm4m;FC Volendam;FC Groningen;VOL;GRO;[['Groningen', 'cos9hxi16eitbcbthof7zrm4m', 2, 70, 'ar7ybu7dordgt2yfx5inux62', 'I. Määttä', 'YC']];Kras Stadion;[['Volendam', '6g9qrm72224jrk6tkxxxi8a9n', 1, 21, '3kbhgmnf6bhfgut0jxf4m2sfe', 'G. Oristanio'], ['Groningen', 'cos9hxi16eitbcbthof7zrm4m', 2, 50, 'alxccjq2y6il5yjw108a0axnt', 'J. Hove'], ['Volendam', '6g9qrm72224jrk6tkxxxi8a9n', 2, 55, '5shfqpd5fj05qrp1jlzd08ftg', 'C. Twigt'], ['Groningen', 'cos9hxi16eitbcbthof7zrm4m', 2, 73, 'emglxnqrlqskt8krglv7sziwa', 'R. Pepi'], ['Volendam', '6g9qrm72224jrk6tkxxxi8a9n', 2, 78, '6jqn5grsuhuo5at81pzahr6xh', 'R. Mühren']]
637365;;;CAM;FOR;1;2;2023-01-29Z;2022-23 Eredivisie, Regulier seizoen;Opmerkelijke VAR-momenten bezorgen Fortuna zwaarbevochten zege op Cambuur;"Fortuna Sittard heeft zondag op bezoek bij SC Cambuur een zwaarbevochten zege over de streep getrokken: 1-2. Na in de eerste helft op achterstand te zijn gekomen, draaide de ploeg uit Sittard het duel in de tweede helft helemaal om na twee opmerkelijke VAR-momenten.

 Met Cambuur nam trainer Sjors Ultee het op tegen zijn oude ploeg. Ultee werd dit seizoen al na drie speelrondes ontslagen bij Fortuna en moet nu Cambuur in de Eredivisie zien te houden. Dat geldt ook voor Julio Velázquez, de opvolger van Ultee, bij de club uit Sittard. Beide ploegen wonnen hun wedstrijd in de midweekse speelronde en stonden dus met een goed gevoel aan de aftrap.

 Buitenspel
Iñigo Córdoba dacht Fortuna halverwege de eerste helft op voorsprong te koppen, maar de Spaanse aanvaller stond buitenspel op het moment dat Arianit Ferati zijn voorzet gaf. Zo ontsnapte Cambuur aan een achterstand, waarna de thuisploeg in de 31e minuut zelf toesloeg.

 Na een vlotte aanval over de linkerflank bediende Daniël van Kaam met een teruggetrokken bal Mees Hoedemakers in het zestienmetergebied. De 24-jarige middenvelder, die eerder dit seizoen al twee keer scoorde tegen Fortuna (1-4 zege), schoof de bal beheerst in de verre hoek binnen: 1-0.

 Halverwege de tweede helft debuteerde Ben Rienstra uitgerekend tegen zijn oude club in het shirt van Cambuur. De 32-jarige middenvelder liet afgelopen zomer zijn contract bij Fortuna ontbinden en was sindsdien clubloos. Rienstra tekende deze week tot het einde van dit seizoen in Leeuwarden.

 VAR-momenten
Ondertussen werd Fortuna steeds gevaarlijker voor het doel van Cambuur, maar de ploeg uit Sittard wist het net nog niet te vinden. Dat gebeurde pas na een curieus moment met een hoofdrol voor de VAR.

 Cambuur kreeg een strafschop na een overtreding van Rodrigo Guth, die met rood van het veld moest vertrekken, op Mitchel Paulissen, maar even daarvoor was Burak Yilmaz aan de andere kant in het zestienmetergebied neergehaald. Op advies van de VAR werd er dus geen strafschop aan Cambuur maar aan Fortuna toegekend en mocht Guth blijven staan.

 Yilmaz schoot vervolgens overtuigend raak en bracht zo zijn ploeg weer op gelijke hoogte. Even later dacht Fortuna weer op voorsprong te komen, maar na een treffer van Vitesse-huurling Thomas Buitink ging de vlag voor buitenspel weer omhoog. Toch was daar uiteindelijk het doelpunt voor Fortuna dankzij Córdoba die profiteerde van uitstekend voorbereidend werk van invaller Tijjani Noslin.

 In de blessuretijd leek Cambuur nog een strafschop te krijgen na een overtreding van Ivor Pandur op Remco Balk en ook nu besloot de VAR om in te grijpen en ontsnapte Fortuna. De uitploeg klimt door de nipte zege naar plaats elf op de ranglijst, met 22 punten, terwijl Cambuur op plek zeventien blijft steken - met 12 punten staat het nu op gelijke hoogte met hekkensluiter FC Groningen.

###

";3kiix9ybtqh5ghnb0ghxrkhsk;ears40cp6opsgvhsy0dgyszpd;3ebril33e08ddzob4bhq8awsr;SC Cambuur Leeuwarden;Fortuna Sittard;CAM;FOR;[['Cambuur', 'ears40cp6opsgvhsy0dgyszpd', 1, 16, '7r2ifipuieqiar5n00o2j5uj9', 'L. Bergsma', 'YC'], ['Cambuur', 'ears40cp6opsgvhsy0dgyszpd', 1, 43, 'afsin57n25r53ifmqyfmbzqol', 'R. Uldriķis', 'YC'], ['Fortuna Sittard', '3ebril33e08ddzob4bhq8awsr', 1, 45, '8rqula41yqtbwycgemsw9ixud', 'B. Yılmaz', 'YC'], ['Fortuna Sittard', '3ebril33e08ddzob4bhq8awsr', 2, 64, 'b2h6iojtnu8rzb81vw4rbfrop', 'G. Cox', 'YC'], ['Fortuna Sittard', '3ebril33e08ddzob4bhq8awsr', 2, 72, '7t19aebk75lrt41hmclk18mhh', 'D. Siovas', 'YC'], ['Fortuna Sittard', '3ebril33e08ddzob4bhq8awsr', 2, 83, 'hjb0mn4fgmfiimwn5odvl8fd', 'T. Buitink', 'YC']];Cambuur Stadion;[['Cambuur', 'ears40cp6opsgvhsy0dgyszpd', 1, 31, '8o13oyr0lqkr5sw7j9ekdan6x', 'M. Hoedemakers'], ['Fortuna Sittard', '3ebril33e08ddzob4bhq8awsr', 2, 75, '8rqula41yqtbwycgemsw9ixud', 'B. Yılmaz'], ['Fortuna Sittard', '3ebril33e08ddzob4bhq8awsr', 2, 84, '4tc5741xue1eigwcu4t7qtuc5', 'Iñigo Córdoba']]
637366;;;FOR;SPA;0;0;2023-02-03Z;2022-23 Eredivisie, Regulier seizoen;Sparta laat ook in Sittard punten liggen na doelpuntloos gelijkspel;"Fortuna Sittard en Sparta Rotterdam zijn vrijdagavond niet tot scoren gekomen in de openingswedstrijd van dit Eredivisieweekend. Beide clubs schrijven dus een punt bij. Sparta blijft daardoor zesde en Fortuna blijft steken op plek elf.

 In de eerste helft deden de teams niet onder voor elkaar. Sparta had meer de bal, maar kon dat niet uitdrukken in kansen. Allebei de keepers kwamen daardoor amper in actie tijdens de eerste 45 minuten. De teams gingen dan ook rusten bij een stand van 0-0.

 Na rust kregen de supporters in het Fortuna Sittard Stadion meer voorgeschoteld. Met name de thuisploeg werd een aantal keer gevaarlijk. Sparta-doelman Nick Olij, die eerder vandaag werd uitgeroepen tot speler van de maand, moest daarom een aantal keer aan de bak. Hij kwam vrijdagavond tot zes reddingen.

 Kort voor tijd had Iñigo Córdoba de winnende goal nog op zijn schoen, maar de aanvaller van Fortuna Sittard schoot over. Hij vergat zijn team in de 83e minuut op een 1-0 voorsprong te zetten. Zo bleef het bij 0-0 in Sittard. Het is voor de derde keer op rij dat Sparta niet weet te winnen.

###

";3kmektl3m9h8y85qawshuh89g;3ebril33e08ddzob4bhq8awsr;89w5c6pw7vn0dxypi61tt0g4k;Fortuna Sittard;Sparta Rotterdam;FOR;SPA;[];Fortuna Sittard Stadion;[]
637367;;;VOL;AZ;1;1;2023-02-04Z;2022-23 Eredivisie, Regulier seizoen;AZ laat na koppositie te pakken bij Volendam;"Feyenoord blijft na dit weekend, ongeacht de uitslag in de kraker van zondag tegen PSV, koploper van de Eredivisie. AZ is er namelijk niet in geslaagd op bezoek bij FC Volendam de Rotterdammers te passeren. Nadat de Alkmaarders op achterstand kwamen redde Jens Odgaard een punt: 1-1.

 AZ-trainer Pascal Jansen moet Bruno Martins Indi en Sam Beukema al langer missen. De opties centraal achterin werden deze week nog schaarser doordat Maxim Dekker uitviel tegen FC Utrecht (5-5) en ook Reichedly Bazoer en Zinho Vanheusden niet fit zijn. De 18-jarige Wouter Goes debuteerde daarom in het hart van de defensie naast Pantelis Hatzidiakos.

 Balbezit leidt niet tot kansen
Het scoreverloop van de eerste helft in het Kras Stadion stond in schril contrast met het spektakelstuk van vorige week in Alkmaar. Toen had AZ slechts 34 minuten nodig om liefst drie keer het te vinden. Tegen Volendam ging dat een stuk moeizamer. Het vele balbezit van de ploeg van Jansen werd niet omgezet in doelrijpe kansen. Volendam liep veel achter de bal aan, maar wist groot gevaar te voorkomen. De brilstand bij rust was een logisch gevolg.

 Oristanio benadeelt zijn ploeg
De Wijdbroeken beperkten zich in de tweede helft niet alleen tot verdedigen en meldden zich na een uur spelen voor het doel van Mathew Ryan. Op het moment dat Sven Mijnans zich ontdoet van zijn trainingspak voor zijn debuut, snijdt Carel Eiting een vrije trap perfect aan op het hoofd van Mbuyamaba die 1-0 binnenkopt. Volendam schoot zichzelf daarna in de voet. Door een rode kaart van Gaetano Oristanio na doorlopen op Jordy Clasie werd het moeilijker om de voorsprong vast te houden. Ruim tien minuten voor het einde maakte AZ dan ook gelijk. Een geplaatste bal van Odgaard zette AZ weer naast Volendam.

 FC Volendam-verdediger Mbuyamba kopt FC Volendam op voorsprong uit een vrije trap van Eiting.

 Tegen de tien van 't Andere Oranje voerde AZ de druk op voor de winnende. Maar het nummerieke overwicht kon niet worden verzilverd. De Volendamse defensie hield stand en sleepte een punt uit het vuur.

 AZ komt door de remise op 41 punten. FC Volendam komt op 17 punten en blijft voorlopig boven de degradatiestreep staan.

###

";3kq3g6tsfh5ix5ifx9yrlfaxg;6g9qrm72224jrk6tkxxxi8a9n;3kfktv64h7kg7zryax1wktr5r;FC Volendam;Alkmaar Zaanstreek;VOL;AZ;[['AZ', '3kfktv64h7kg7zryax1wktr5r', 1, 26, '2w7xspkzg7b9ghl20me202ove', 'T. Reijnders', 'YC'], ['Volendam', '6g9qrm72224jrk6tkxxxi8a9n', 1, 36, '6jqn5grsuhuo5at81pzahr6xh', 'R. Mühren', 'YC'], ['AZ', '3kfktv64h7kg7zryax1wktr5r', 2, 61, 'ad2qplv0aa66l11ipq6yh0hd5', 'Y. Sugawara', 'YC'], ['Volendam', '6g9qrm72224jrk6tkxxxi8a9n', 2, 76, '3kbhgmnf6bhfgut0jxf4m2sfe', 'G. Oristanio', 'RC'], ['AZ', '3kfktv64h7kg7zryax1wktr5r', 2, 90, '7sd87ylfbtgwgpb70hf68cel1', 'V. Pavlidis', 'YC']];Kras Stadion;[['Volendam', '6g9qrm72224jrk6tkxxxi8a9n', 2, 62, 'c9epkro6fot3km9zak1kswfhm', 'X. Mbuyamba'], ['AZ', '3kfktv64h7kg7zryax1wktr5r', 2, 83, '1t7nph4960rjzu7rgi47sf8ix', 'J. Odgaard']]
637368;;;UTR;HEE;1;0;2023-02-04Z;2022-23 Eredivisie, Regulier seizoen;Goudhaantje Douvikas bezorgt Utrecht met rake strafschop zege op Heerenveen;"FC Utrecht heeft in eigen huis met 1-0 van sc Heerenveen gewonnen. De winnen goal werd gemaakt door Anastasios Douvikas. De Griek schoot een strafschop raak, waardoor Utrecht de punten pakte. Door de zege loopt Utrecht op de ranglijst verder weg bij Heerenveen. Het heeft nu een voorsprong van 5 punten op de nummer Friezen en staat zevende. Heerenveen staat een plaatsje lager op de achtste plek.

 Matige eerste helft
Beide ploegen bakten er niet veel van voor de rust. De supporters in Utrecht moesten het doen met een aantal pogingen van Sydney van Hooijdonk, Douvikas en Can Bozdogan. Heerenveen-doelman Xavier Mous, nog altijd op goal vanwege de blessuren van Andries Noppert en Utrecht-goalie Vasilis Barkas waren bij de les en konden redding brengen.

 De wedstrijd bleef in evenwicht en de kleedkamers werden na 45 minuten opgezocht bij een stand van 0-0.

 Geen fijne tweede helft Heerenveen
De tweede helft begon matig voor Heerenveen. Jeffrey Bruma, die zijn debuut maakte bij Heerenveen, viel al snel met een blessure uit. Ook zag het Utrecht steeds meer in de wedstrijd groeien. De Domstedelingen waren beter, maar kwamen nog niet echt tot grote kansen.

 In de 69ste minuut kwam Utrecht toch op voorsprong. Antoine Colassin begin een overtreding op Othmane Boussaid, en scheidsrechter Richard Martens wees naar de stip. Douvikas, die vorige week een hattrick maakte in de knotsgekke wedstrijd tegen AZ (5-5), ging achter de bal staan. Douvikas schoot de bal niet goed binnen en Mous raakte de bal aan, maar kon de 1-0 niet voorkomen.

 In de slotfase ging Heerenveen nog volle bak op zoek naar de gelijkmaker. Even leek Che Nunnely die ook te maken. De aanvaller tikte de 1-1 binnen, maar deed dat in buitenspelpositie.

 In de 10 minuten blessuretijd werden de Friezen nog een aantal keer dreigend, maar konden ze de Utrechtse defensie niet slechten. Het bleef bij 1-0.

###

";3kxmpzqwbk83ifjn6uhjpzk7o;ccpscwdcm65czscrun048ecn5;4vd2t5schmvvufrfib7f2vjdf;FC Utrecht;SC Heerenveen;UTR;HEE;[['Heerenveen', '4vd2t5schmvvufrfib7f2vjdf', 2, 66, '1tj9gmnm02s8f12zwzvuwnoph', 'P. Bochniewicz', 'YC'], ['Utrecht', 'ccpscwdcm65czscrun048ecn5', 2, 84, 'ely6vpyueden4b6ozfmspwgk5', 'J. Toornstra', 'YC'], ['Heerenveen', '4vd2t5schmvvufrfib7f2vjdf', 2, 86, '34258m1cvslz8r6d17nv4b90q', 'S. van Ottele', 'YC']];Stadion Galgenwaard;[['Utrecht', 'ccpscwdcm65czscrun048ecn5', 2, 69, '1p0xp2onnys7jlru55vfgf1pm', 'T. Douvikas']]
